{
  "schema_version": "1.0",
  "run_id": "fixture-run",
  "root_path": "/home/claude/file-tree-pipeline/test/fixtures/sample_tree",
  "generated_at": "2026-09-06T22:34:00+00:00",
  "nodes": [
    {
      "node_id": "sha256:44575cf5b28512d75644bf54a517dcef304ff809fd511747621b4d64f19aac66",
      "path": "build",
      "type": "directory",
      "size_bytes": null,
      "mtime": "2026-09-06T22:33:30+00:00",
      "ctime": "2026-09-06T22:33:30+00:00",
      "extension": null,
      "content_type": null,
      "content_hash": null,
      "symlink_target": null,
      "permissions": "0o755"
    },
    {
      "node_id": "sha256:d31aef9e358703a6486daedab5f7698edbf86d1b33824eeb985fe1e48613ea30",
      "path": "build/output.o",
      "type": "file",
      "size_bytes": 0,
      "mtime": "2026-09-06T22:33:30+00:00",
      "ctime": "2026-09-06T22:33:30+00:00",
      "extension": ".o",
      "content_type": "application/x-object",
      "content_hash": "sha256:e3b0c44298fc1c149afbf4c8996fb92427ae41e4649b934ca495991b7852b855",
      "symlink_target": null,
      "permissions": "0o644"
    },
    {
      "node_id": "sha256:46b42b4229cd7a39c564e780bb665a8bde4fdf722007e8473f167fe53ed4b995",
      "path": "docs",
      "type": "directory",
      "size_bytes": null,
      "mtime": "2026-09-06T22:33:30+00:00",
      "ctime": "2026-09-06T22:33:30+00:00",
      "extension": null,
      "content_type": null,
      "content_hash": null,
      "symlink_target": null,
      "permissions": "0o755"
    },
    {
      "node_id": "sha256:0b5ca119d2be595aa307d34512d9679e49186307ef94201e4b3dfa079aa89938",
      "path": "docs/README.md",
      "type": "file",
      "size_bytes": 13,
      "mtime": "2026-09-06T22:33:30+00:00",
      "ctime": "2026-09-06T22:33:30+00:00",
      "extension": ".md",
      "content_type": "text/markdown",
      "content_hash": "sha256:5b91956b36f77846ddaa49115ac394bdd4376e99ed802eebe71aee9335db29f3",
      "symlink_target": null,
      "permissions": "0o644"
    },
    {
      "node_id": "sha256:98f38f12db221a8cf8ca7aadfdcd759b01d52eb4ebb3eedbb2d97e92805c6960",
      "path": "logs",
      "type": "directory",
      "size_bytes": null,
      "mtime": "2026-09-06T22:33:30+00:00",
      "ctime": "2026-09-06T22:33:30+00:00",
      "extension": null,
      "content_type": null,
      "content_hash": null,
      "symlink_target": null,
      "permissions": "0o755"
    },
    {
      "node_id": "sha256:69fbf3b70d0d0fa2f7f351e2773d5902d555022fbb159b06ff021059e6b0922c",
      "path": "logs/app.log.2019",
      "type": "file",
      "size_bytes": 8,
      "mtime": "2026-09-06T22:33:30+00:00",
      "ctime": "2026-09-06T22:33:30+00:00",
      "extension": ".2019",
      "content_type": null,
      "content_hash": "sha256:9fe200693a36ab3895efbf81b51cb9970b68d7e64b59fdb73586fca86940ebdf",
      "symlink_target": null,
      "permissions": "0o644"
    },
    {
      "node_id": "sha256:cc116c7b4512c89ddd983b960eb5949dab1030834daebda87e1a85a8eb5679f5",
      "path": "notes.txt.bak",
      "type": "file",
      "size_bytes": 10,
      "mtime": "2026-09-06T22:33:30+00:00",
      "ctime": "2026-09-06T22:33:30+00:00",
      "extension": ".bak",
      "content_type": "application/x-trash",
      "content_hash": "sha256:54d048ab0699bcf1fff66455775c49a538241b098d9aad8b9ae35eba96528201",
      "symlink_target": null,
      "permissions": "0o644"
    },
    {
      "node_id": "sha256:25a6634263c1b1f6fc4697a04e2b9904ea4b042a89af59dc93ec1f5d44848a26",
      "path": "src",
      "type": "directory",
      "size_bytes": null,
      "mtime": "2026-09-06T22:33:30+00:00",
      "ctime": "2026-09-06T22:33:30+00:00",
      "extension": null,
      "content_type": null,
      "content_hash": null,
      "symlink_target": null,
      "permissions": "0o755"
    },
    {
      "node_id": "sha256:2e5ad92c43aa96cc3a9cef6c6aec998b216f1379c43b1f651013d25e55989312",
      "path": "src/main.py",
      "type": "file",
      "size_bytes": 15,
      "mtime": "2026-09-06T22:33:30+00:00",
      "ctime": "2026-09-06T22:33:30+00:00",
      "extension": ".py",
      "content_type": "text/x-python",
      "content_hash": "sha256:03e693d9f2f687e0f40e36a8df7fcb4d1c22974012b7c2a55c000eb30f305824",
      "symlink_target": null,
      "permissions": "0o644"
    },
    {
      "node_id": "sha256:dbb46a5c3c1dde41c39f7fa3bab89f20932237b7d1f2011dff7edc884b8e8a06",
      "path": "src/main_copy.py",
      "type": "file",
      "size_bytes": 15,
      "mtime": "2026-09-06T22:33:30+00:00",
      "ctime": "2026-09-06T22:33:30+00:00",
      "extension": ".py",
      "content_type": "text/x-python",
      "content_hash": "sha256:03e693d9f2f687e0f40e36a8df7fcb4d1c22974012b7c2a55c000eb30f305824",
      "symlink_target": null,
      "permissions": "0o644"
    }
  ]
}
